{
  "schema_version": "1.0",
  "source_id": "B02-duolingo-2025-10k",
  "primary_audience": ["investor"],
  "delivery_objective": "commercial_due_diligence",
  "source_material_type": "investment_memo",
  "evidence_profile": ["annual_financials", "historical_comparison", "risk_disclosures"],
  "industry_compliance_context": ["public_disclosure", "financial_promotion_boundary"],
  "delivery_scenario": "investment_committee"
}
